title,selftext,subreddit,created_utc,name
How to 'See' better in Apex,"I have a friend who plays, and I watch him share his screen relatively often when I am eating. Among the things he needs to learn to get better, one of the biggest things just seems to be that he doesn't see enemies very well. If an enemy is anywhere at all on my screen, I have a 99.999% chance of seeing them, sort of like how you expect eyes to work. But my friend seems to only be able to notice about 75% of enemies on his screen. If they are not 100% super mega easy and obvious to see, there's a decent chance he misses them completely, and then will turn his back to look at something else and then die to being shot in the back. I know this post will mainly get troll replies or no replies, but if there is any advice anyone has about what to tell him or how to train your eyes to see enemies better, I would love to hear them. He has gotten better at many aspects of the game, but I am at a loss as to how to teach him to notice enemies better. And until he does, he will always be stuck with the phrase ""WHERE DID HE COME FROM?!?"" on his lips.",apexlegends,1705897128.0,t3_19cn13l
Who’s the most important in your opinion?,"In duos or trios.

I personally feel as if life line is the most important character. The added capacity for anything in the bag because of never having to carry health packs and mid combat res and healing is too much to overlook.",apexlegends,1705895135.0,t3_19cmeo2
2.75s/k. Gun SPRINT.,,apexlegends,1705893840.0,t3_19clzrw
First game in a couple months,"“Meh” with the total kills I had, but I had no idea about this Final Fantasy Crossover. The sword was a nice surprise 😂",apexlegends,1705892172.0,t3_19clgeq
After I opened my free pack my deathbox became this all the time…,Asked my teammates if they dropped $360 in this event they said nope…,apexlegends,1705890789.0,t3_19ckzog
Just broke game's logic,"Playing on an NA server, tried to pick a purple shield through Loba's black market, My partner took some milliseconds before me and this happened.

&#x200B;

https://preview.redd.it/3o714dgtjwdc1.png?width=1919&format=png&auto=webp&s=8792d801aa8bd9ece79efbd0da9c77d0551af10a",apexlegends,1705890476.0,t3_19ckw4k
Apex Legends Character Concept: Fracture,"Name: Fracture. 
Role: Assault.  
  
PASSIVE: Last Chance: When you’re downed, you can use your custom semi-auto pistol to damage enemies. Any kill or down will automatically revive you with 30 hp.   
  
TACTICAL: Rewind: Place a Teleportation pad that you can teleport back to at any time. Max distance of 40 meters. (25 second cooldown).
  
ULTIMATE: Pain Cycle: After a 6 second charge, you will deal 85 damage to all enemies within a 35 meter radius, at the cost of downing yourself. Any downs or kills made with the ultimate will not trigger the passive. If you don’t damage anyone with the ultimate, you won’t be downed. (2:15 minute cooldown).  
  
ADDITIONAL INFO:  
   
PASSIVE: -The pistol you use has similar stats to a P2020. 
  
-you can switch between using your knockdown shield and your pistol. You can’t.  use both at the same time.    
  
-click your tactical button while downed to switch between the knockdown shield and the pistol.  
  
-to prevent the passive being used recklessly, the enemy who downed you will be immune to the pistol for 3 seconds.   
  
TACTICAL: -You click your tactical button to place the Teleportation pad. You click it again while the pad is placed to teleport to the pads location.  
  
- The tactical is similar to vantages tactical. If your tactical is off cooldown and is in range, it will be colored blue. If it’s on cooldown, it’ll be orange. If it’s out of range, it will be red.  
  
- you can recall the pad at any time.  
  
ULTIMATE: -If you miss your ultimate, and no enemies are damaged, you won’t be downed, and 25 percent of your ultimate will be refunded.  
  
- during the 6 second charge time, enemies will be notified that they are in the ultimates range.  
  
-Your teammates will be slowed down by the ultimate, instead of damaged.",apexlegends,1705889377.0,t3_19ckjjc
"Every time I get shot, my guns stop ADS-ing. Am I the only one with this ADS bug? It's just about ONLY in ranked, I have only seen it once in mixtape but could've been a fluke?",,apexlegends,1705888495.0,t3_19ck8x4
Ruined clip.,Botched the wall jump at the end RIP. ,apexlegends,1705887567.0,t3_19cjy28
"People who never get client-side stutters in-game, do you exist and what are your specs and interesting tweaks made?","e.g. 12700k RTX 3080 32gb RAM 1440p 240hz monitor. E-cores and hyperthreading diaabled Nvidia Reflex On

Just trying to piece the jigsaw of the microstutters I have been experiencing in-game together. It feels like it's CPU related as E-cores being disabled appears to improve things, but still occasional stutter here and there.

I'm also at the point of assuming everyone has performance issues with this game or something. I've got a capable system and tried every fix imaginable only to still stutter in gunfights. I'd love to be able to fix this issue once and for all",apexlegends,1705885720.0,t3_19cjb8f
Did a lil funny and broke fuses ankles,,apexlegends,1705884861.0,t3_19cj03b
Why do so many people leave after the game starts,"Hi, returning s1 player. Haven't played the game for years, wanted to try it out again. Been enjoying the event mostly, just wish they kept the regular trios mode. But whenever I play every other game one of my teammates leave at the beginning or jump somewhere solo, die, then leave. Is this just bad luck, or is there something I'm missing? 

Also, is there another way to unlock more characters besides grinding the red currency?",apexlegends,1705883739.0,t3_19cimcr
Final Fantasy Free Pack in Store,"I know noticed that you can purchase an event pack in the event store (the store that you use gil). Are you able to purchase more than one?

Will get enough gil to buy it tomorrow and was wondering if I should save it or spend it.",apexlegends,1705883632.0,t3_19cikzv
Is there an audio bug right now?,"I’m having people literally walking or dropping down on my nape with a gun to it with no audio. I understand footsteps being muted over special abilities taking precedence over it, but I’ve gone down 3 games now with only bullet sounds near me and my teammate has also experienced it as well.

This started happening this week the most. I know they worked on horizon audio/ ambient sounds audio I’m wondering if something else might have been accidentally touched to make it where footsteps aren’t being heard at all behind you",apexlegends,1705881093.0,t3_19choej
"First clip after a long break of from the game, really happy with it",I guess muscle memory was very helpful here 😂,apexlegends,1705880662.0,t3_19chitp
Catalyst nerfs are to much.,"I agree catalyst was to strong, but waht they did to her was just to much 

Ult duration 30->27  ok still good.

The core of her traps dosnt sponge damage anymore. Ok those guys took 200+ damage to destroy so no biggy with that.

Decrease from 3 to 2 activ traps. Oooook not the biggest fan of that 

Throwing range decreas. Just no. Not good.

And now they want to impliment line of sight to the traps? In my eyes thats with the throwing nerf the worst neft they coud have done. The thing that makes the traps so good is that they are not only traps but also indicators when enemies are close, now we have to see how thats working out.

And now for la grande final. The main reson for this post and the one thing that gets on my nervs even more than the nerfs is the one thing that respan DIDNT nerf is the god dam blindnis effect if you walk thouh her ult. I dont have to explain this qe all have bin there.",apexlegends,1705880586.0,t3_19chhwb
Arguing for the return of arena.,"I think arena would be a better place for new players to start than br. Just a  round based  match were you can find the wapon of your choice and maybe play against players who arent apex preds with 100000+ Kills. But who am i to juge, thats why i wanna know your opinnion.",apexlegends,1705878515.0,t3_19cgpgg
Are there only two bangalore thematic trackers and the last one is from season 10?,"I'm waiting for a new bangalore thematic trackers to show up in the battlepass since season 10, but after 9 seasons, there was no luck. I was wondering if the devs totally gave up making trackers for this specific legend?",apexlegends,1705877916.0,t3_19cgh0s
Luck or skill,,apexlegends,1705876668.0,t3_19cfzu0
Missing event item?,I've opened 3 event packs but only showing 2 items unlocked... Anyone else have this problem?,apexlegends,1705875318.0,t3_19cfgvr
Which character is best for team support?,I’m getting back into apex for the first time in forever and I now have no idea which characters are the best. Someone please help.,apexlegends,1705875316.0,t3_19cfgus
Pay attention,Yipeeeee,apexlegends,1705874708.0,t3_19cf866
Getting queued with only PC players,I play Apex with a friend who is on PC (I am on console) and we only seem to get queued into matches with other PC players. Is there a way around this in settings? Or is it simply the way crossplay is set up?,apexlegends,1705874634.0,t3_19cf747
I love the buster sword,I have never had so much fun playing apex. I don't care what anyone says. Dashing round the map and comboing people is just incredible. I hope it comes back at some point.,apexlegends,1705874129.0,t3_19cezl9
"Pt,2 Yall a fan of decent aim?",,apexlegends,1705873753.0,t3_19ceu5p
Is there a limit to how many event packs you can get with Gil?,"I only got one pack using Gil, I thought you could get as much as you can spend?",apexlegends,1705873735.0,t3_19cetwo
Can't craft,So my friend has the bug that he can't craft at times. More so when he is in the ring. It brings the menu up for a split second and then closes. Is there any settings or anything to change as I don't have this problem. This is on xbox.,apexlegends,1705872860.0,t3_19ceh5i
I was panicking so much (as you can see) idk how I’ve just done this,,apexlegends,1705872831.0,t3_19cegpa
The last thing you see before dying,FanArt made by me in Blender,apexlegends,1705871967.0,t3_19ce3qx
How do I get this last rev tracker?!,It’s driving me insane that I don’t have the middle one 😂,apexlegends,1705871423.0,t3_19cdvvq
Kanye hates seer video,"Does anyone have the video where a kanye ai generated voice says ""oh my fucking god I hate seer nerf him to the fucking ground"" it came out near the start of season 10 and to my knowledge is completely lost",apexlegends,1705869559.0,t3_19cd52s
Hardly any scopes are spawning?,"I'm going entire games, through multiple PoI's and finding 1 or 2 scopes. It feels like they're at about 10% of normal.",apexlegends,1705869225.0,t3_19cd09m
The buster sword is what ashs heirloom should have been.,"Ash even has a heirloom where she says ""buster sword here....a weapon for for a titan"" like it isn't exactly like ronin's but it could have been easily done as a ash main I'm buying the sword.(I already have ashs heirloom btw ",apexlegends,1705867358.0,t3_19cc99i
1v3 ,"1v3 clutch in ranked, managed to get the quick shield swap for the last kill. Sorry for no sound it was glitched on the capture ",apexlegends,1705866974.0,t3_19cc3ny
"Hated WE when I left after S11. Back for S19, still hate WE just as much","Dont think I've ever had a good game on WE since I first played it. Cant seem to find a rhythm or rotation I find enjoyable or successful. The inevitability of me selecting a landing spot as jumpmaster, only to watch at least 1 teammate head for fragment instantly.

Any tips for finding this map fun? Pubs only, I have no desire to play ranked.",apexlegends,1705866765.0,t3_19cc0r3
Stutters and Lag,Hey everyone. I used to play apex back like 2 years ago and I just came back this year on pc and I never dropped under the 144 frame cap. My specs are (I3 12100f and an RX6650XT). According to the benchmarks with these specs are supposed to give me around 170+ fps on average and that's what I used to get. One of my ram sticks became faulty tho and now I'm on 8gb of ram and now when I open the game the maximum frame rate I get is about 105 with a very janky frame time graph so as you can probably guess I have a shit ton of stuttering. I've seen people run 8gb comfortably and according to YouTube benchmarks I dont think my ram should be bottleneck me that much. Maybe it's something else I'm not sure and I don't know how to figure out why the game is barely playable rn. Thank you in advance for any help.,apexlegends,1705865992.0,t3_19cbpjm
Have we named this guy yet,Have played in a month fist game on I bumped into this guy .I'm wondering if we have named him yet if not let's hear them,apexlegends,1705865519.0,t3_19cbitc
"Was gonna say ""You should DC""",,apexlegends,1705864860.0,t3_19cb9ek
"Stuttering in Apex Legends, does anyone know the solution","CPU: 12700k GPU: RTX 3080 32gb of 2400mhz RAM

I play on mouse and keyboard. Feels like I've tried everything. It tends to stutter more in gunfights I've noticed.",apexlegends,1705864692.0,t3_19cb71b
Anybody know where to find the good quality nessies plushes?,Help would be very much appreciated because I want to get it as a birthday gift a close friend and I want to get them a good quality one ,apexlegends,1705864430.0,t3_19cb3ao
Anti Cheat Error - Please Help,"A guy in my trio is experiencing this issue and we can’t seem to figure out the proper solution. 

Before any unhelpful comments are made please know that he is a mnk player, doesn’t not use any type of cheats, and we play casually. 

This error just popped up for him in the last couple days. We have had no issues before this. We tried the run anti chest as admin. Uninstalled from ea app and reinstalled on steam. Verified game files, looked at Microsoft update, the list goes on. 

Any and all help would be appreciated.",apexlegends,1705864135.0,t3_19cayzv
Some Kraber shots I hit about a month ago in D1 ranked.,,apexlegends,1705863960.0,t3_19cawjc
I’m enjoying this season..?,"Am I just.. an idiot? 

I’ve seen absolutely nothing but negative shit.. constantly. This season has been fine for me. The matchmaking in ranked has been fine. I’ve had good games, I’ve had bad. I’ve destroyed people, I’ve gotten destroyed. I’m ranking up steadily. The balance has felt pretty good. Conduit is pretty OP but the new character is OP basically every time they release one. 

Am I stupid and I shouldn’t be enjoying it? Is this subreddit just un-pleasable in general? Am I missing something? All of the above? I dunno. Just putting some thoughts out there and I am curious.",apexlegends,1705863394.0,t3_19cao3w
Why is Solo Q'ing in Apex so much better then Warzone?,"I hate to be the guy that brings up another BR game into this forum, but I thought it was noteworthy to discuss the complete night and day difference of random teammate quality between Apex and Call of Duty WZ.

I took a small Apex break and have playing the new WZ3 update for the past several weeks since release and it's just been an absolutely hair pulling experience as a lifelong solo Q'er. I've played around 25 hours in total and put in around 200 games and each and every squad fill experience has been nothing but 12 year old kids blasting their music over the mic, kids who have no mic at all, zero team work or cohesion whatsoever, and just general chaos. A complete lack of common sense in nearly every game I played. 

I went back into Apex ranked yesterday for the first time in weeks and won my first game and vibed with my randoms perfectly. It was so refreshing to just have a sense of everybody being on the same page whether were on the same skill level or not. I don't know if it's the ping system, if COD players are just more brain dead, or if the game is just more so heavily reliant on vocal comms but at any rate.. it's good to be back !",apexlegends,1705863330.0,t3_19can87
Wraith in Multiverse,,apexlegends,1705863044.0,t3_19caj81
I love how Vantage was so eager to push and then quits after getting baited,,apexlegends,1705862703.0,t3_19caecn
Ratting in Mixtape,Why are you so scared in mixtape? Especially gun run and TDM. You're doing nothing for your team. From hiding in a corner to staying on height getting no kills. Its just detrimental to your team. It's a casual game mode. Just play.,apexlegends,1705862549.0,t3_19cac6x
Get baited,,apexlegends,1705862483.0,t3_19cab7d
I like when they line up for me,,apexlegends,1705862356.0,t3_19ca9ap
character select screen ??,"So I know respawn changed how the character select works, if your legend is taken it switches to the one you have the most kills on. I used to have the most kills on bloodhound but i farmed crypto for awhile and I have like 200 or so more kills on crypto now. It still always chooses BH for me which is a bit annoying because I don’t really care for BH or their play style anymore. Just wondering if anyone else has experienced this / how to fix it 🤔",apexlegends,1705861904.0,t3_19ca2sm
4th final fantasy event pack,"On the event it page it says "" Four pack will guarantee a legendary or iconic item"" . Im on my 3rd pack. So does that mean if i open a 4th pack will that guarantee a legendary skin from the event such as the gun skins ? Or can the legendary be any legendary item from the base apex pack pool ? ",apexlegends,1705861852.0,t3_19ca204
Ambush!,Wraith left the game before we even landed. Wattson died off drop and quit before giving me a chance to pick her up. Figured I'd stick around and see what I could do. Managed to get the drop on a full team. ,apexlegends,1705860289.0,t3_19c9fgl
Ash's common skins missing, Just wanted to check with other but is their Ash common white skins missing from the game? ,apexlegends,1705858680.0,t3_19c8s95
Why did they remove the spectacting icon?,"You used to have a little icon to let you know that you were being spectated. 

But it has been removed. 

Why?",apexlegends,1705856786.0,t3_19c81ic
No game capturing?,Recently as of last night I can’t clip my clips. Xbox won’t let me record this game. Just had a 16 kill solo dub really wish I could clip it. Anyone else having this issue?,apexlegends,1705856742.0,t3_19c80vm
I ain’t got time to bleed,,apexlegends,1705854148.0,t3_19c70kg
Thanks to Conduit I am happy to return to Apex. Conduit is missing piece of a puzzle this game needed.,"I always found difficult to play Apex Legends because of the sweats and match making. No matter how much I practice in terms of work-life-hobby balance (NOT playing each day 18 hours), I mostly end up being dead in 1-2 minutes of gameplay or being loot goblin for 10 minutes and then dying instantly making someone happy with all the loot I had.

Instead of improving aim and movement (requires a lot of time that I can't afford to waste because of job, family, hobbies) I always wanted to be a better support player. Active healer, or active teleporter to safety or something.

&#x200B;

Unfortunately, many support legends still required offensive gameplay. Lifeline? Yeah you can heal... If your teammate and you survived the sweats. Revive? Try to defend lol. Loba? Well... What's the point in looting if you die after that quickly.

&#x200B;

But with Conduit... I like this one! I actually can HELP during a fight. I can heal shields quickly and give needed support. Even middle skilled player can have a chance against sweat with additional shields.

And oh boy, having those shields through the walls and with this distance... I think Conduit is a healthy addition to the game that was starting to die out for casual players because of the sweats (I play the game more than 3 years and I can say that 2-3 years ago I was not obliterated THAT quickly like nowadays).",apexlegends,1705853897.0,t3_19c6x0t
Sentinel my beloved,,apexlegends,1705853714.0,t3_19c6uho
Apex pack count question,Does anyone know what happened to the bad luck prevention counter once the accounts were merged (500 pack guarantee)? I'm assuming it's whatever count the highest level account had?,apexlegends,1705853054.0,t3_19c6lla
Follow Teammates or Not,"I'm struggling with trying to decide if I should follow teammates that like to hot drop or push fights early game in ranked. Had several games yesterday where my TMs had dropped at opposite ends of a POI ( I was jm). They pinged enemies, which I thought they were doing just to make us aware, but no. They were pinging to solo engage. Then my other TM rushes in after my first TM gets knocked. I wanted to abandon them, but felt guilty not going in after them.

This happened several times and each time our squad got eliminated. Should I just ignore aggressive TMs that want to pick fights early or should I always follow and hope for the best?",apexlegends,1705852903.0,t3_19c6jcc
Q.o.L. suggestion for Conduit Ult,"When Conduit launches her ult ( and stuff isn't in the way ) , it usually makes a left to right line in front of her.

I've had a few times when I've been in a position where I'd like to launch the ult forward to back.Any chance of adding a ""right click"" command when she has her ult out that when held allows you to rotate the path on it's central axis? Allowing to position the ult more usefully without having to position YOURSELF to get the desired result.

( The two large gates leading to the old prowler den on Storm Point is a perfect example - you need to move down and stand in front of the gates to get the ult to go across them both, with the added tweak you could do the same thing whilst standing against the fence )",apexlegends,1705852383.0,t3_19c6cbp
Kinda feel bad for Gibby,,apexlegends,1705851959.0,t3_19c66qd
Oce ranked dead?,"Hi,
It’s s literally lly impossible to get oce ranked lobbies im forced to do Singapore but playing on 200 ping is dreadful. How do people get matches.",apexlegends,1705851415.0,t3_19c5zbs
Staying alive,For all that is good in this someone please explain to me why my teammates are consistently getting one clipped or they’re getting killed from across the map consistently? Situational awareness is absolutely abysmal in this game. Someone please make it make sense to me!,apexlegends,1705848442.0,t3_19c4xds
So apparently this little spot will get you killed due to out of bounds,,apexlegends,1705847028.0,t3_19c4gry
What the hell is happening (whenever i load in my game freezes and unfreezes everytime and it doesn’t seem to load some parts),,apexlegends,1705845790.0,t3_19c42it
What's up with EU servers?,"For the last weeks/months I have to return to the main menu every 3rd or 4th game cause my game won't reconnect to EA servers after a game is finished. I don't have that problem on US servers, but the higher ping ain't the favorable option. Any word on this from Respawn or is it yet another bug that'll last?",apexlegends,1705844186.0,t3_19c3k6o
What's up with conduits in ranked?,"Almost every second team you come across has a conduit now. My team fought 4 teams in one match and every single team had a conduit. 

It's the same situation as seer but now that the streamers/pros aren't going ape shit nothings being done about it. How is this balanced?. 

Seer (lmao),Valkyrie is redundant now that evacs are a thing,Ash has useless tactical,Bangalore smokes come out with a delay plus a 4 minute ult,caustic gas damage and radius nerf,wattson can't place fences in corners so they are always visible from an angle. I can go on but you get the point. How is any of this ok?.",apexlegends,1705841335.0,t3_19c2q5h
If you rat until the end of the game this is what you look like,,apexlegends,1705840498.0,t3_19c2hyg
"It's so much fun playing with friends, when I was on 30 frames I avoided it but now I'm IGL with my two friends and been having a blast Solo Q and 3 stacking on my alt to start from Zero with higher frames. I can feel something great building with us because it's just ""easy"" like we say.",,apexlegends,1705839332.0,t3_19c26ln
Anybody winning more after reWASD ban?,I got more champion wins today than my whole week combined. I think reWASD might have been used massively for hacks before.,apexlegends,1705834473.0,t3_19c0y08
Live by the sword and die by the sword!,,apexlegends,1705833607.0,t3_19c0qdn
Glitch in ranked,"
Loading into rank matches but puts me in normal br for some reason, anyone got this too?",apexlegends,1705828855.0,t3_19bzl8c
"""Push with me! He can't get us both!""",,apexlegends,1705826480.0,t3_19bz0p4
Firing range update ideas,"The dummies could be set to play out and movement ability.

-A dummy takes an octane jump pad for example and we can practice gaining accuracy for shooting someone who’s moving at that speed or midair.
Horizons lift and pathfinders ziplines as well.

- The firing range could also basically be upgraded to the level of Halo ODSTS fire fights. Waves of enemy’s keep coming with their abilities and shield levels rising as you kill more. (We can summon actual legends to fight against)

- Maybe even a dummy who you can use finishers on 

-I know that the firing range was updated a few seasons ago and it’s impressive as is. These were just a few suggestions I had, anybody have thoughts or ideas that come to mind?",apexlegends,1705825390.0,t3_19byr5u
Catalyst Reinforced Door Duration,"Lets say a Catalyst dies and team is wiped, but they had reinforced a door. How long does the door stay reinforced for?",apexlegends,1705825026.0,t3_19bynzk
