title,selftext,subreddit,created_utc,name
Remove Wattson's Pylon map from the TDM rotator,"It's singlehandedly the most dogwater map for this gamemode ever. One team goes up the middle and camps, you can't do anything, especially if you got PvP superstars in your team that don't hit 1k dmg in 15 minutes. Remove it.

&#x200B;

[This](https://www.reddit.com/r/WattsonMains/comments/17gyyik/we_got_a_stormpoint_poi_wattsons_pylon/) is the map btw",apexlegends,1705707746.0,t3_19axhkf
First Look at next season’s new map,"Idk how many people caught this, but I think Suotamo is the actual name of the code named “District” map. You can zoom in for a better look.",apexlegends,1705706903.0,t3_19ax5lb
Should the Havoc alternate sniper fire come back?,Just found out that the Havoc used to have an alternate fire mode that would act as a sniper. This sounds and looks super fun and interesting. It seems perfect for Apex in its current state. Apex needs a little shake up and it could temporarily give us that. What do you think,apexlegends,1705704396.0,t3_19aw5g1
Please stop hot dropping if you are not that guy,If you ping the hot zone and do less than 100 damage you need to reevaluate. It’s ok to have a bad game. It’s not ok to keep pinging hot and have a bad game.,apexlegends,1705704286.0,t3_19aw3xi
I am massively disappointed by this community,"It has been almost two weeks since the event started, and I don’t think I’ve seen a single good, high effort “Nessie Army” video!
Like, wtf are you people even doing right now?
Do people not realize they can have 6-7 Nessies running around and fighting with them? It’s hilarious!

Where is my “Zombie Nessie Army” video?
Where’s my “Dawn of the Planet of the Nessies” video?
“World of Nessiecraft”?
“Band of Nessies”?
“The Nessie King”?

Enough with all this crying about swords and all that crap.
Creators, get off your asses and give us the high quality Nessie content we all crave and need!",apexlegends,1705703780.0,t3_19avwog
Ping System > Mic,"You dont need mics to communicate effectively.

Your call outs take longer to process than a visual indicator, and are prone to misguidance . I.e. statements like ""they are low"", ""one shot"", ""they are here"", ""they are there"". It only serves to confuse.

In high stress situations why would you want people talking over the already almost non existent footsteps? Or even worse talking AND pinging (often spam pinging). You cant hear or see anything as teammates spam ping multiple enemy locations. 

And if you are going to use your mic. Make sure people can hear you well. Dont get mad because none of us can hear your call outs over the game. And no matter of raising your voice in stressful situations actually makes anyone try harder or somehow aim better. 

I say this because my best games have come from quiet games. No one is speaking. Pings are precise and not spammed. And my team is using all the types of pings to communicate.

My worst games often come from being confused in high stress scenarios. People talking, people pinging, and still no idea where the enemy is. Maybe skill issue, but I feel I'm not alone.",apexlegends,1705703656.0,t3_19avuuq
I comment and post about my performance in Apex but I never really showed how I play. Thanks to all the people who look at my dog water VOD's. Can anyone tell me how to tone down my deaths? Most of the advice on gun run is to stick with teammates but sometimes it doesn't work. which is why I'm here.,,apexlegends,1705703385.0,t3_19avr0n
"If I hit Master, am I guaranteed the rank?","As in, if I reach Master a mind then never play a single game of ranked until next season, will I stay master?",apexlegends,1705703329.0,t3_19avq9f
Apex website restock?,So I was wondering if anyone knew if they do restocks for the apex website because I love this sweatshirt but they sold out in my size… wondering if this was a temporary thing or if they would do a restock of the same exact one in the future. If anyone has any info please share! Thank you.,apexlegends,1705702277.0,t3_19avbcp
"the ranked winning kill, and my shitty aim",weeee,apexlegends,1705702022.0,t3_19av7ou
Shotgun in game,Everybody who uses any type of shotgun in this game. Should Kurt Cobain himself and let his family post a video of your corpse on this sub reddit. Get some skill,apexlegends,1705701524.0,t3_19av0ck
Lag spikes,"I have been playing apex for quite some time recently and never experienced much lag at all but the last few days I have been experiencing major lag spikes to the point of crashing, nothing has changed with my home internet I’m just wondering if anyone else has experienced this or know how to fix",apexlegends,1705700370.0,t3_19auk23
How to fix Vantage,"Vantage is a ""suvivalist sniper"" in the recon class that is barely picked across all game modes, ranks, and skill levels. She also has a 0% pick rate at a pro level. Overall, I think her kit is great and she is fun to play, but it's clear she needs some kind of buff or change to make her more viable. 

I would keep both her passive and tactical the same. The passive fits the recon class and is quite underrated in providing useful information through the Spotter's Lens. I would also keep her tactical echo location the same as it fits the sniper roll allowing her to reposition during fights. It is also quite balanced because she is has an absolute chonker hit box and the ability is slow to use - not like the instant-getaway mobility that skirmisher like horizon brings. 

IMO, the real issue with Vantage is her ultimate, sniper's mark. For starters, she is a mobile recon agent, so why give her a damage-dealing ultimate? The damage is very lackluster unless you hit multiple shots which are capped at 6. It's also so weak when guns like the 3030 are in the game that do more damage, are faster, and have more than 6 bullets.  The damage bonus mechanic is lackluster and rarely capitalized off of. The sniper in its current state also teeters between being weak and insanely OP. If they increased the damage per bullet or increased the multiplier duration, it could result in a really OP sniper or a really oppressive mechanic. Overall, it's just a bad design and needs to be changed. 

My suggestion to fix her Ultimate would be to remove/reduce the damage portion of the sniper and make it primarily a recon ability. If you tag someone with the sniper, it highlights the enemy to your entire team - similar to maggie's ability Warlord's Ire that highlights enemies she damages. If hit by the dart, the player can remove it by holding interact over 1-5 seconds, similar to removing a Cypher dart in Valorant. This not only makes the ability more in line with her recon class and role, it makes her more team-oriented and creates an interesting and similar dynamic to that of choosing to heal vs. fight as it would force players to stop and remove the dart, or keep it on risking that you are fully highlighted. It also rewards skill and accuracy and isn't just a press-a-button free wall hack ability like Seer/BH. I would also suggest they increase the handling and hip fire of the sniper greatly. I picture a super fast auto-rifle recon dart gun instead of a slow single-bolt sniper. You should be able to quickly tag, swap, and capitalize.

What do you think?

TLDR: Vantage is bad. Change her sniper ultimate to a recon dart that highlights the enemy for the whole team. Dart can be removed by holding a button like Cypher from Valorant. Buff the sniper's handling, speed, and hipfire. Decrease the damage or remove it entirely. Make Vantage an actual recon sniper that provides utility to the team.",apexlegends,1705699863.0,t3_19aucpb
The thing that absolutely annoys me the most.....,"It's not when Octane is being a fuckhead loot fiend...

It's not when Lifeline doesn't know how to use their passive...

It's not this fucking stupid as shit Buster sword we are forced to deal with...

# IT IS when someone chooses my fucking main and are complete trash with them, and they just quit when they get knocked. ",apexlegends,1705699137.0,t3_19au2ej
How Is This Possible???,,apexlegends,1705697683.0,t3_19athsr
And we lost to them :D,,apexlegends,1705697288.0,t3_19atc7n
Master volume resets on launch,"Ever since the mid-season update, my master volume keeps resetting to 100% every time I launch the game. My profile document in the saved games/respawn path is not set to read only or anything like that. Anyone have any insight?",apexlegends,1705696818.0,t3_19at5lj
"I'm having a apex ""retrieving matchmaking list"" problem, need a fix","yesterday i tried logging into the game but i got the ""retrieving matchmaking list"" and ""data center: downloading.. 0"" issue, looked up, turned out its a new thing, tried every fix i saw (restarting/reinstalling the game, changing dns to googles free dns or to 1.1.1.1 fast dns) but no lock i still have it, if somebody has another fix id be happy to try it.

&#x200B;

https://preview.redd.it/hhpaac9ejgdc1.png?width=1920&format=png&auto=webp&s=614945fb1683d331afb93bb87fcdbd220498c906",apexlegends,1705696529.0,t3_19at1hy
The ALGS 4 trailer is hype af,,apexlegends,1705696409.0,t3_19aszqn
Yall a fan of decent aim?,,apexlegends,1705696386.0,t3_19aszex
Sentinel Squad Wipe. My favourite Sniper <3,I love sniping. ,apexlegends,1705695007.0,t3_19asfht
Cant start game together,"Hey people,

My mate and i play duo on ps5. Every few matches He cant joint the game ans only Sees ""Party not ready. We both have to restart the game to fix it for a few games.

Any solutions on this?",apexlegends,1705694990.0,t3_19asf89
Aim Assist Nerf?,"I don't know what it is, but has anyone feel like aim assist got silent nerfed ever since they introduced the final fantasy update? I found it weird that my aim was so inconsistent ever since the update and kept thinking it was my controller or that my settings was changed but nothing at all has been touched. (pc controller). I saw some other threads and a few people confirming my theory but I just wanted to double check and make sure.",apexlegends,1705694935.0,t3_19asehc
sometimes its too sad to even tell jokes abt some bots,,apexlegends,1705694863.0,t3_19asdha
mirage and the sword are the perfect combo,,apexlegends,1705694745.0,t3_19asbs1
Can't get in the game,"The game doesn't enter beyond the main menu, says its unable to connect to ea server, been like that for a few days, first it sats retrieving matchmaking list and then cant connect to servers. Help pls!",apexlegends,1705694760.0,t3_19asbzi
Nessi finally has a friend,,apexlegends,1705694280.0,t3_19as4mo
ANyone getting this glitch?,"So recently whenever im 1v1ing my friend and i use an Ash ult. My PS5 cant seem to run apex after and apex crashes. Every other legend ult/ tac works completely fine. Any help?

(I'm also a Horizon main. Don't get mad at me, ik ash is doo doo lol)",apexlegends,1705694153.0,t3_19as2u1
Concrete evidence that player vision is based on movement.,,apexlegends,1705693853.0,t3_19aryns
Will I miss out on anything in the event if I miss a day?,"So, lots and lots of people are losing power & dealing with shitty winter weather all across the US currently. Myself included! Been a week and finally the power went out. Now I'm curious, if it's out the whole day will there be rewards I miss out on? I figure if I miss a couple days I'll definitely miss out on something.",apexlegends,1705693135.0,t3_19aro9j
Apex keeps crashing.,"I just got a PS5 and I've been playing apex for roughly a month. Out of the blue, the game cuts off and Sony tells me an error occurred. This has happened on numerous occassions. Is it something with the game or something with the Playstation?",apexlegends,1705692596.0,t3_19argdm
What would you do? 1. Revenant jumps on you 2. He has a buster sword 3. You have a P2020,,apexlegends,1705691154.0,t3_19aqvla
"Ff7 is my favorite game of all time. They failed hard with the ""crossover""","What a waste. 🤦‍♂️ They could have done so much more without having to drop hundreds on cosmetics.

Fuck you EA",apexlegends,1705690373.0,t3_19aqk53
Weird fps drops,"I use a gaming laptop and with low graphics I can run the game smoothly at about 60-80 fps but the longer I play for the more my fps will randomly drop for a few seconds to about 20-30 fps and then it will go back to 60-80 any idea why or how to stop it?
 I have checked other games this is only for apex",apexlegends,1705690012.0,t3_19aqetx
Solo No Fill Buster Sword Only Challenge This was tough,,apexlegends,1705689163.0,t3_19aq2rz
Can u pls fix your game!!,"Ok apex pls explain this

[in a ranked match i get this random error. ](https://preview.redd.it/ao91b7wrmfdc1.png?width=1366&format=png&auto=webp&s=a8ca21c657789b4a18c7ad24158079ba8b6fa445)

![img](xdy5ukxvmfdc1 ""after is im back in the main menu i get also this :) 
"")

Your ranked system is already broken as it can be, but now u giving me also this stupid errors ??  
So i lost like 100 points when i was already in top 5 with 4 kills and 3 assists... So stupid",apexlegends,1705685672.0,t3_19aondm
Remove Rewasd or any software that gives you advantage on M&K If you got this error. Thats the only fix.,,apexlegends,1705685025.0,t3_19aoe0g
Triple take choke on or off?,Could someone please explain which is best? Didn't even know you could turn it on and off. I think I have been living under a rock. Thanks!,apexlegends,1705684959.0,t3_19aod3m
The Flash fights be like,,apexlegends,1705684737.0,t3_19ao9s7
Vader 3 pro Apex legends,Hey anyone play this controler in apex ? What you bind on your extra button?,apexlegends,1705683784.0,t3_19anvpu
Sentinel ,"Hit a good clip today hehe
",apexlegends,1705682075.0,t3_19an6xs
Favorite underrated weapon?,"I've always found that using the often overlooked weapons in Apex is a lot if fun, and I'm wondering what others like to use when they try it as well. My personal favorite is the charge rifle, instead of rewarding snap aiming it rewards tracking (which I honestly find more difficult due to the freedom of movement in this game), and just one hit is enough to fully break a blue shield. What are your guys' thoughts on these types of things?",apexlegends,1705682003.0,t3_19an5w6
Mixtape no respawn bug,"Just played a game of tdm. Something happened during one of my deaths, i got stuck in the spectate menu. Any idea why this happened and how i can avoid it?

UPDATE: Changing res fixes it. But it happened again ",apexlegends,1705681978.0,t3_19an5hx
That sword terrifies me,,apexlegends,1705681862.0,t3_19an3ql
Long alt tab (stretched res),"Hello, need help and a solution on why alt tabbing is slow even if I changed my nvidia control panel to match my in game stretch res. Please help, cannot stand 10 second alt tab black screen.",apexlegends,1705680922.0,t3_19amq3c
Is the content of Youtuber LewiTrotter legit?,"I am quite new to Apex and was looking for some content to see how people approach fights etc.

I have stumbled onto this youtube channel by a guy named LewiTrotter. He is a pred player, mostly doing challenges for his channel (win with every legend within 24h, 20 bomb with every gun etc.). In the beginning I was amazed how he racks up those kills and gets to these fights.

However, after seeing other people's content and my own fights, I have started to wonder whether LewiTrotter is getting legit players of his caliber or just really low ranked players. 

Why am I saying this:

* In some instances the opponents simply don't shoot him or push him when he is low
* He seems to be able to use his Horizon Q to heal up fully, often right above the opponent's heads. If I did that, they'd beam me back to Valorant.
* During his challenge using all the legends, he doesn't seem to use the legend's ability well or at all. Is his gun fighting ability that good that he could basically play CS in Apex with no issue?

I lack the game knowledge to tell whether his lobbies are legit - other people seem to notice that too judging by his YT comments. 

Do you think this is legit or did I get fooled?",apexlegends,1705679228.0,t3_19am1uv
Horizon cosplayer clutches up,,apexlegends,1705676162.0,t3_19akx69
No limit on Event Packs with Gil.,"That is some shady dark pattern BS to pull. If I had known that the Event Packs would be available in week two then I would have saved all the Gil from Week 1, obviously. No Respawn, I still will not spend a dime on your umteenth ""gambling"" event no matter how many times you screw me over. 

Anyone else just waiting until this GaaS trend collapses in on itself so we can get back to games for fun and devs actually making content instead of casinos?",apexlegends,1705673597.0,t3_19ak0ou
"Game just suddenly started giving me this error and I cant play anymore ""The client failed anti cheat runtime integrity check: connection timed out""","I tried repairing game files, verify game integrity, restarting router + pc. Nothing seems to work, just randomly started happening today. ",apexlegends,1705672258.0,t3_19ajjln
Seer needs to be Reworked but not Reborn,"I know I'm going to be crucified for this as most people hate Seer and want to keep him 6 feet under but hey, I think it might be better to toss the idea out there. I personally think Seer needs to start with a clean slate but not reborn. I love his legend fantasy of being the person who sees all but I think he's super overloaded with what his abilities do and would heavily benefit from being a little simplified. Here's how I would personally change him and this is from someone who loves to play Seer and love his ability to give great information, but hate how they keep hitting him back and forth like this making him unplayable when solo queuing and just worse than BloodHound when with a squad, albeit very deserved as he was actively making the game worse when he was strong.

Goal: Make him a much more information based legend. Make his scan the primary focus and make his tactical not do 1000 things all at once as it's the reason why he just can't be balanced. Nerf his passive without making it completely useless and buff his ultimate into being somewhat less situational.

HeartSeeker: Make him have to genuinely dedicate to his passive. Keep the beat rate thing that tells you if someoneis low on health. Give it a secondary indicator that tells you if there are multiple people with low health(ie. Two out of sync heartbeats, cap of 3). his passive while he has a gun out. Keep the passive's current accuracy(maybe even lower it) but make its range match his tactical. Make it much quieter. Remove the indicator that shows how close an enemy is(varying levels of how orange his ring is). Bring back his ability to sprint while using it. 

Focus of Attention: Make his tactical faster as it is way too easy for anyone with even 1/4 of a braincell to dodge it. Keep the silence but lower its duration to 5 seconds. Give it a pulsing scan that acts as a ping (Scan would stay stationary because having constant information is busted) every 2.5 seconds(2 scans). Keep the threat vision with line of sight as it should be good at countering smoke. And of course, remove the slow function that it has as its just unnecessary and overkill, same with the revealing of health and shields.

Exhibit: Keep his ultimate basically the same but give it the same pulse scan that I gave the tactical at a lower frequently due to its long duration, maybe once every 5 seconds. I actually like where his ultimate is at although it is rather weak in most place on the maps and would like a clearer indication of where everyone is, especially when in a more open area. When people shoot, you tend to already know where they are so I think it just needs a little pick-me-up.

This is just what I came up with for how I'd like to see him changed in the future but what would you guys personally do with him because I like seeing what other people would do to fix such a poorly designed and handled legend. 

TLDR Seer doodoo, design and numbers, change him please Respawn <3",apexlegends,1705672243.0,t3_19ajjfc
D-pad not functioning?,"I got on apex today and for whatever reason my D-pad on my controller has stopped functioning in apex entirely (almost. Ill hit the button and it might trigger 2-7 minutes later that's not an exaggeration) I've tested it in other games and it works just fine. Anyone else having this issue. And before I get asked, no I don't have any CFG's on. (Restarting the game, steam and my computer itself, even reinstalling the game. All have proved fruitless) - This happening to anyone else? - Anyone have any plausible fixes?",apexlegends,1705672103.0,t3_19ajho4
"EVO Bug, has anyone seen this?",,apexlegends,1705671610.0,t3_19ajbg6
What are they trying to do with ranked? (Old predator player),"I played Apex religiously when it came out and I stopped playing around season 5 after I finished with a predator rank and got busy with life. I've come back now and ranked seems so unfun.

Why is Apex so focused on forcing people to go for placements, rather than playing the game? I understand the need to reward placements, but it feels like it's placements or nothing at this point. If I get 10 kills a game I shouldn't be able to still lose my rank, It just seems crazy to me. Back when the game first came out the biggest complaint I saw was about rats in ranked, but now it seems like that's the only way to play. ",apexlegends,1705670757.0,t3_19aj1dn
I unlocked the orange chocobo,,apexlegends,1705669897.0,t3_19airfa
Does anyone know what happened to some weapon charms,"Some or all of my golden colour charms epic rarity have gone missing anyone know what's happened
Thanks in advance",apexlegends,1705667145.0,t3_19ahy90
Indian Servers?,"Dear devs,

The game is over 4 years old but there is no server expansion into regions like the Indian sub-continent etc. Any upcoming plans to expand? soon?",apexlegends,1705666325.0,t3_19ahpui
The buster sword heirloom,"If each pack costs 100 AC and there's 36 packs, that means it will cost 3600 AC, where is everyone getting $400 from? Or am I missing a key detail?",apexlegends,1705663939.0,t3_19ah2bg
Ranked searching,"Am I correct in understanding that if you’re playing ranked with for example; Master,Plat,Gold - then the entire team will be essentially searching at masters? Or can you not play with those that are ranked 1-2 Tiers above? Pls help <3",apexlegends,1705663299.0,t3_19agwb1
I really LOVE the heavy hitting guns,"Although I'm not really good at using fast bpm weapons so far, heavy hitting guns are always there for me <3

https://reddit.com/link/19agqin/video/cqixev0lqddc1/player",apexlegends,1705662689.0,t3_19agqin
I want wingman to be removed from CP,Eventhough its a beast in cp i just want it to return back to ground loot. Its so fun to use. Ngl i feel like im john wick whenever i get my hands on one. What do you think about returning wingman from cp to ground loot?,apexlegends,1705661271.0,t3_19agdkm
Peak apex gameplay right here,Gonna shoot for pred next season after this.,apexlegends,1705661132.0,t3_19agcg7
Did they fixed aim assist bug on ps5 or am I buggin?,"I know for sure that I had few matches with normal aim assist, and sometimes it just didn't work even though the match, it just didn't stick, even close close range. But now it sticks like a glue to a person close-mid range. So my question, am I just crazy, or people who had the same issue have the same experience now?",apexlegends,1705661009.0,t3_19agbe5
"Game just suddenly started giving me this error and I cant play anymore ""The client failed anti cheat runtime integrity check: connection timed out""","So just randomly the game started giving me this error and it throws me out of every game after like 3 minutes. I tried removing the EAC folder from Apex directory and fix files but that didnt help. Non of the typical solutions found after searching this problem help. I did nothing different before/when this started. Please help  


EDIT: I've tried fixing game files from steam, Reinstalling and fixing EAC, reinstalling the game, updating Nvidia drivers and nothing has worked yet",apexlegends,1705659862.0,t3_19ag1uz
"I'm no longer a $150 PC Master player, so next season I'll hit Pred on actual frames and lol I just been pushing everything I want to now.",,apexlegends,1705655849.0,t3_19af3i2
Finding back my 2 Wallons teammates,"Last Saturday I joined a ranked game and met 2 “Wallons”. We won that game and started to play together afterwards. 

We added each other via Apex. My game crashed during the second game. And I took a quick break.

When I wanted to invite them, I couldn’t find them anymore.

One of them was playing Bangalore and the other one Rampart.

Hope to find them here!",apexlegends,1705655237.0,t3_19aeyi1
Finally managed to get this,,apexlegends,1705653681.0,t3_19ael8y
So we all hate Gun Run right? ... Not me!,"So I used to be in total agreement with the consensus that Gun Run was a crap game mode. But, thanks to the current Final Fantasy event thingy going who really *is* crap (lol) I've play a lot more often mixtape.

And wouldn't you believe... I've started to dig Gun Run. Not just accept it, but DIG it.

See, there's something about being FORCED To use a specific setup that has a strange appeal to me now. It's like the game is saying, ""This is it, make the best out of it, and get a kill or be stuck with it forever.""   
And when the gun switch and I look down at my hands it's either ""oh crap!"" or ""hell yeah!"" and both of those reactions are followed by an equal ""BRING IT OOOON"".   


I tell ya guys, this mode aint that bad. It's about mindset, imo. Take the mode for what it is, the challenge is in handling the various guns properly, and it'll only make you a better player at the end of it.

Nevermind your stats after the round, just enjoy the challenge for what it is.

&#x200B;",apexlegends,1705653269.0,t3_19aehqu
