title,selftext,subreddit,created_utc,name
Hot drop store is mid,"You would think with all the glitches and dry ass content in this game, they would at least make buying skins somewhat good but looks like they fumbled it so hard. The skins i’m getting are terrible compared to some I seen my friends get and the skins aren’t even on “sale” like they are claiming to be? I wouldn’t mind all that if they atleast made the store refresh instead of keeping it till Feb 6th",apexlegends,1706046167.0,t3_19dzw3r
"Imagine being the conduit. Spotted a threat, but it is already too late to alert your friends. You can only see them die one after another, and eventually, it's your turn...",,apexlegends,1706045837.0,t3_19dzrcf
weeeeeeee weeeeeeeeee weeeeeeee,,apexlegends,1706045659.0,t3_19dzonv
Is this real?,,apexlegends,1706045725.0,t3_19dzpng
Ranked... Make it make sense,"My buddy & I have been gone from apex for about 5 seasons. We are currently at the same rank Gold 2. He is leveling up 2.5x faster than me. He gets skill bonus and I have yet to see a skill bonus. How does this new ranking system work, it's kind of frustrating. We are in gold playing in master lobbies every match it seems like.",apexlegends,1706045296.0,t3_19dzj7z
Apex Hot Drops VS Features Store Prices,,apexlegends,1706044924.0,t3_19dzdv8
No more event store items?,"Nothing in the store except the badge. This is my first time doing an apex legends event, just picked up the game a few weeks ago. Is there really nothing else for the last week of the event?",apexlegends,1706044178.0,t3_19dz2wy
Cool this Hot Drops is so nice... oh...,,apexlegends,1706043608.0,t3_19dyufk
Double Duty Badge," So for conduit I've tried getting the badges for Double Duty, and have done what the description says twice now where I'm the Kill leader and Champion. So last time I got it I managed to take a photo of it and I sent it to Apex Legends on Facebook, Twitter, and on their complaints page and I've never heard back from any of them. Do you guys have any idea of who to reach out to or do I just accept Ill never get this badge I've been trying to get for a while now. ",apexlegends,1706043420.0,t3_19dyrts
Hot drops store not working,"I went to check hot drops store and the tab just isn't there, is anyone able to help with this issue",apexlegends,1706043178.0,t3_19dyob6
Are swords meant to be long-range?,,apexlegends,1706043041.0,t3_19dymds
i flipping love this sword...,,apexlegends,1706042846.0,t3_19dyjpj
Lore Sources,"I need it. All of it. I'm trying to drown myself in it. I know the game itself has lore, and I know of the comics. But it doesn't feel complete. I'm trying to locate everything! Videos, scripts, those weird chat bubbles Apex did back around the time Newcastle came out, everything!

Basically I'm trying to see what the community themselves have found so that I can catch up. Just post your sources in the comments!",apexlegends,1706042801.0,t3_19dyj1o
Event box,I got two holo sprays & the Car skin from the three event boxes.. awesome,apexlegends,1706042604.0,t3_19dyg7h
Low FPS during the ship drop with decent PC,"So I just bought a new pc, and I noticed that during the ship drop when you look at the entire map below you, the fps drops drastically, from an average of 150 fps during normal gameplay, to a miserable 60 fps during the drop, like cmon, on a RTX 4070? That's absurd.

My friends have way less powerful rigs than mine, they play at max settings on a 2K monitor just like me, but they output an average of 100+ fps during the ship drop, so there is something not quite right here, any suggestions?

My pc:  

* **CPU:** AMD Ryzen 5 7600X
* **VGA:** Gigabyte GeForce RTX 4070 Windforce OC 12G
* **RAM:** G.Skill Trident Z5 RGB 6400MHz 32GB 2X16
* **SSD:** Gigabyte Aorus Gen4 5000E M.2 NVMe 1TB
* **MOBO:** Gigabyte B650 Gaming X AX
* **SO:** Windows 11 Pro OEM",apexlegends,1706042354.0,t3_19dycgb
Why is my 2k not showing up over 2 days later?,,apexlegends,1706042026.0,t3_19dy7vq
So the rev invisible glitch is back?,"EA will do anything but fix servers, gameplay, bugs etc… but that’s alright isn’t it because a overpriced bundle will make up for it, right?",apexlegends,1706041684.0,t3_19dy2sl
Final ring 3 pred teams invisible console ranked,,apexlegends,1706041170.0,t3_19dxve8
"3 free Gil packs = this is what i got, thank god i don't spend money on this fucking game or i would be maldingg fr",,apexlegends,1706040780.0,t3_19dxpzq
Ranked is so lame,"I miss the old Ranked and I refuse to play this new one, there is no reward to do anything but rat and its incredibly frustrating. I could get 7 kills off spawn in Rookie and it doesn't matter towards my rp until like top 5 squads are left it's so dumb",apexlegends,1706040749.0,t3_19dxpk7
Store showing 6 tabs before loading,"As you can see, in the top right corner, there are 6 store tabs. It only shows this when the game is not fully loaded yet and instantly reduces to 3 or 4 tabs after its done loading. Does anybody know why this happens all the time?",apexlegends,1706040681.0,t3_19dxoks
Conduit Player One,Has anyone gotten the Conduit Player One skin to pop up in the new Hot Drop shop? I regret not getting that one.,apexlegends,1706040639.0,t3_19dxnym
hotdrops store:,"yeah sick discount lol  
4600 for the bundle normally? 

[hotdrops store vs normal store](https://preview.redd.it/2ybiji56y8ec1.png?width=283&format=png&auto=webp&s=a9e1806d4ac231f332ac8b94a2682aaa561d4cf0)",apexlegends,1706040541.0,t3_19dxmlu
Any good yellow/orange badges I can unlock?,My wraith trackers are all orange (from the unshackled event if anyone wants to see the exact colour) and so is my banner (it's the legendary one with all the skulls and candles) so I'm looking for some badges to match the colour. Unfortunately I only have one badge from the unshackled event so I need two more orange badges. Can anyone give me some ideas?,apexlegends,1706040539.0,t3_19dxmks
Ranked is terrible,Returning player from s8. Was consistently Plat in ranked. Even solo q. Now I can't seem to get to Silver. I know I've gotta shake the rust off but like it seems I'm playing against diamonds and master every game. While playing in bronze lobbies. Is there something I'm missing?,apexlegends,1706040377.0,t3_19dxkbo
anyone else not getting the hotdrops in shop,"when i load up shop to see if there was the new hotdrops there wasnt anything exept feature, is anyone else having this problem?",apexlegends,1706040056.0,t3_19dxfkf
Loot changing upon landing.,"Today the squad and I saw a purple shield through a window while landing. When we went to grab it, it turned into random junk loot. Has anyone ever encountered this?",apexlegends,1706040039.0,t3_19dxfan
The way she's holding that Kunai is actually really uncomfortable,,apexlegends,1706039961.0,t3_19dxe40
Opinions on a ‘no thirsting EXCEPT finishers’ mode?,"Probably a really dumb idea, but it does let people stay in the game for longer without them having to wait for a beacon, plus it gives finishers more spotlight which is always nice",apexlegends,1706039950.0,t3_19dxdya
SENTINEL INFINITE CHARGE GLITCH IS BACK!!!! (Tutorial),[https://www.youtube.com/watch?v=JjYSvw3ta28&ab\_channel=iiTzRhatari](https://www.youtube.com/watch?v=JjYSvw3ta28&ab_channel=iiTzRhatari),apexlegends,1706039550.0,t3_19dx8ai
I thought Respawn changed this so they were still obtainable after they drop in impossible scenarios to pick,,apexlegends,1706038770.0,t3_19dwwu2
I threw that thermy perfectly,[https://youtu.be/Dm69\_1NHVQo?si=yelTvc2XQVvf\_TF7](https://youtu.be/Dm69_1NHVQo?si=yelTvc2XQVvf_TF7),apexlegends,1706038754.0,t3_19dwwmh
Loba or Lifeline,"I sincerely wanna hear some opinions.. Would you rather have a Loba or a Lifeline on the team? Let's say small maps, like Kings Canyon or World's edge.",apexlegends,1706038624.0,t3_19dwuqa
Let's See Those Hot Drops Legends!!,"Apparently , Hot Drops are different for each person? Not sure how i feel about it yet . 

Who's For and who's Against , and why?",apexlegends,1706038374.0,t3_19dwr16
Unbalanced Control,"Not sure if this is an unpopular opinion but the KC Control map is *incredibly* unbalanced. I don’t think I’ve played a single game in the last couple months where I started on A and won the game. C is a nice open spawn with one building, wreckage, and a container, while A is a ton of buildings for people to weave in and out of and take full Control of. It just makes for a mode where half the team gives up and surrenders fully to the other team and the other half are just trying to cause chaos and get some dmg / kills before it ends too fast.",apexlegends,1706037921.0,t3_19dwkgc
"Hot Drops have a major flaw, making some deals overpriced compared to previous bundles.","Looking at some of the deals its seems like respawn made a sweeping price point per item making some bundles more expensive before the discount and even some after the discount.

Each item is priced at what each item rarity is supposedly worth (An epic item is 1000, a legendary is 1800, etc.) So a 2 item legendary bundle would orginally cost 3600 coins even if in previous bundles with the same items it was worth somewhere closer to 2250. Some of these discounts make the bundles still more expensive than the orginal bundle price, mostly with the epic rarity bundles and a few of the legendary ones. 

Definitely seems like a major oversight and could absolutely be considered scummy by abusing fomo mechanics if this is the intended pricing scheme.",apexlegends,1706037912.0,t3_19dwkbc
#2 toxic player,This is the most insane gamer rage I’ve ever encountered. Toxic ,apexlegends,1706037869.0,t3_19dwjot
Watch out for him toxic,He’s very racist. He will try to degrade you ,apexlegends,1706037755.0,t3_19dwi15
What legend doesnt have a skin that sucks?,"For me its either revenant, bloodhound and maybe wraith. its like respawn focus on their skins more than others but i do not care cause rev and wraith are the 2 legends i play",apexlegends,1706037518.0,t3_19dwegd
New hot drops issue???,Has anyone else had problems with the new hot drops? Mine weren't there when I opened the game reloaded it and they were paid 40 bucks for some coins to get 2 bundles then they were gone again and didn't come back when I reloaded 3 times....,apexlegends,1706037359.0,t3_19dwc59
What is this?,,apexlegends,1706037240.0,t3_19dwads
I think the hot drops store goes off the last character you’ve played,"The last characters I’ve played were wattson,crypto,rampart, and revenant and I got a shop wit all four in it",apexlegends,1706036727.0,t3_19dw2xt
Hot Drop Store real price,"Was thinking getting personalized shop offers cant be bad. i played some mirage, yes. got a horizon skin in there even tho i dont play her, oke  
checking the normal store, mirage bundle is in there too but with a different price

My Hot Drop Price: 1800 instead of 3600

Normal Store 2150

What

https://preview.redd.it/n6xp7adil8ec1.png?width=497&format=png&auto=webp&s=9ce3df6251838d2edf705469b3a9e6e779effd9b

https://preview.redd.it/zdwcuotil8ec1.png?width=580&format=png&auto=webp&s=edc15b28de34175689fef1397f8f9d097ab8f928",apexlegends,1706036244.0,t3_19dvvky
are configs aloud?,"I've seen some players using the configurations to neo strafe, is this aloud?",apexlegends,1706035439.0,t3_19dvk75
Hot Drop Store is already terrible.,,apexlegends,1706035374.0,t3_19dvj9d
Live Wide Bangalore Reaction,,apexlegends,1706035193.0,t3_19dvgms
"Billion dollars in revenue, can't afford to properly scale images",,apexlegends,1706035191.0,t3_19dvgla
Crypto unable to hack sliding doors at Lava siphon,Just played 2 games on WE and Crypto was unable to hack the large sliding doors at lava siphon command center with the drone. Anyone else encounter this or is it a new bug?,apexlegends,1706034950.0,t3_19dvd4c
No ballistic skins in the new hotdrop,"I only play ballistic and the hotdrops is useless seeing as they have not added any skins to the shop for ballistic... half a year now and still no store skins is crazy 

https://preview.redd.it/3zicz7reh8ec1.png?width=2560&format=png&auto=webp&s=9e34ece5cad886453912e1e8247c1484e74bb590",apexlegends,1706034871.0,t3_19dvby9
Can we acknowledge how f*#king awful matchmaking is for Mixtape?,"Honestly, y'all had me fooled and thinking SBMM (skill-based matchmaking) actually was a real thing, until Mixtape.

It's particularly bad with TDM where it's \~80% of the time a completely one-sided game.

Sure, being on the dominating team *can* be fun, but from my experience being on the completely incompetent one way too many times, it's quite annoying either way when there's no fair competition and just a merc squad running through the map to end the game with a final score of 50-20.

Respawn seriously needs to play Halo like, once, and take some notes.",apexlegends,1706034799.0,t3_19dvavu
Be careful with the new Hot Drop in the Store,"I purchased something and when I restarted my game (bcs the FF Reward Shop is not refreshing with anything new for the week + the Monthly section in Store has zero skins showing when I go there)…. And the skin I purchased was *not* in my inventory, but my Apex Coins were still taken.

If you purchase something, might be useful to take a screenshot after purchase proof.",apexlegends,1706034688.0,t3_19dv969
New Hot Drops Store?,Is this similar to Valorant's night market or something?,apexlegends,1706034574.0,t3_19dv7g5
Monthly shop,Baaannnnggggalore 😭,apexlegends,1706034386.0,t3_19dv4na
Uh… what is this?,"I saw a red mark on the store and checked it and found this, each box lights up red when I scroll over it, can someone tell me what this is?",apexlegends,1706034254.0,t3_19dv2pp
that's a new bug? WHy I can't see holos?,,apexlegends,1706034252.0,t3_19dv2ov
Anyone seeing this too,I love when shop updates and doesn’t fully cycle and just does something like this,apexlegends,1706034064.0,t3_19duzzo
"Just what i wanted from 3 packs - 2 stickers and holospray, thanks mate",,apexlegends,1706033886.0,t3_19dux9o
Wtf is happening to my game ?,"I can't even find a match, I tried to restart the game but it didn't change anything :(",apexlegends,1706033848.0,t3_19duwog
My evil plans be in my head and I just let it run free,,apexlegends,1706033742.0,t3_19duv3k
This is how the Principle of Equivalent Exchange works in Apex,"“Alchemy, It is the scientific technique of understanding the structure of matter, decomposing it, and then reconstructing it. If performed skillfully, it is even possible to create gold out of lead. However, as it is a science, there are some natural principles in place. Only one thing can be created from something else of a certain mass. This is the Principle of Equivalent Exchange” 😁",apexlegends,1706033566.0,t3_19dusc9
Should I use VRR on apex legends PS5?,Please someone explain if having VRR is better than having it off? And why. Also does having VRR on give you latency or that just a myth? Thank you please answer with details and reasoning behind it.,apexlegends,1706033473.0,t3_19duqwa
Idk why I still play this game,The whole game I was following a trail of deathbox’s couldn’t find anyone left. Now I know what I was following and why I couldn’t find anyone ,apexlegends,1706033393.0,t3_19dupog
This might be the single funniest image to come from this game,,apexlegends,1706033386.0,t3_19dupkl
"New hot drop store is live, store content is different for everyone",,apexlegends,1706033357.0,t3_19dup5i
I’m sorry Fuse…,,apexlegends,1706032233.0,t3_19du83i
Help me! Why is this happening??,🙏🙏🙏🙏🙏🙏🙏🙏🙏🙏🙏🙏🙏🙏🙏🙏🙏🙏🙏🙏🙏🙏🙏🙏🙏🙏🙏🙏🙏🙏,apexlegends,1706031908.0,t3_19du38z
Still bronze but i'm slowly getting a hang of this game.,,apexlegends,1706031524.0,t3_19dtxnw
How to make Rampart tac ability not hold?,"Hey guys!

Old apex player here who just came back to the game not so long ago. Im not sure if it's always been like this but when using Rampart's tactical ability, placing down a wall, instead of switching back to her weapon she keeps ""holding"" the wall. Is there a way to make it so when placing down a wall she goes straight back to her weapon and if you want to place another you just use your tac ability again.

Thankful for the answers!",apexlegends,1706030604.0,t3_19dtkfe
double karber clutch,,apexlegends,1706030341.0,t3_19dtgn7
PC crashing a few minutes after I STOP playing apex every time,"Hoping someone else might be encountering this same strange issue:

For approximately the last week, every time I play Apex, after I stop playing, my PC will crash within the next 5 mins and reboot itself for no apparent reason.

Apex launches and runs fine, gameplay is perfect, I close the game with no errors, close the EA app, again without errors, walk away, and within the next 5 mins it crashes/reboots.

This is on a system that has otherwise been incredibly stable for 2 years.

Checking event viewer, I stopped playing Apex at 11:54pm, at 11:56pm the last entry is a gpupdate (successful), then the next entry  is 12:28am saying the OS is starting, with an error after OS start in the event viewer that says: ""The previous system shutdown at 11:57:40 PM on ‎1/‎22/‎2024 was unexpected."".

Any ideas?",apexlegends,1706029959.0,t3_19dtcoa
"I’m scared, what just happened..",Help..,apexlegends,1706029921.0,t3_19dtcba
A Love Letter to the Ranked Random,"Dear stinky poots (not actual username, but a fun play on it),

It was *interesting* to watch you push a fight all on your own against a full team an entire POI away from where we landed, having only grabbed a single weapon and some ammo off of drop. It was exciting to work with our third to get your banner and res you! It’s too bad our third died for the sake of rezzing you too, but we eventually got him back 😊

I was surprised to see (jk, it didn’t surprise me one bit) that you decided to push yet another fight on your own - and into zone, no less! - with naught but your now two weapons and white shield. Later we would learn, after somehow being able to revive you, that you had no meds to make it through to the next zone!

All of this was done with absolutely no communication, not even a single ping!, on your part. It was only when you finally did die to zone that you decided to call us brain dead losers. I’ve gotta admit, that one hurt a bit (/s).

You’re a dime a dozen, buddy. Happy malding and blaming everyone else for your crap. Best of luck to ya! 🙃",apexlegends,1706029671.0,t3_19dt9op
Absolutely hate toxic teammates like this on rank.," I hate toxic people like this revenant. He dropped solo,and spent the whole match chasing every team trying to get kills as if it was pubs, near the last circle he went alone again to fight a 1v6 while me and valk where fighting 2 other squads. He gets knocked and starts spamming ping then when he dies gets on mic and calls us trash for like 5 mins. I still ended up with more kills than him lmao.",apexlegends,1706029449.0,t3_19dt726
what is the best weapon in the games right now,"2: prowler

not very suprising but this thing hits like a train it can fry at medium range auto or brust if you see a prowler this season use it fight someone with a prowler is terrfying

&#x200B;

1: wingman

this is no doubt the best weapon (in my opinion) in the game right now because this thing is a monster if used right 95 to around 105 to the head is disgusting with 50 to the body and 45 to leg what im gonna say is if this isn't the best gun then i dont know what is

&#x200B;",apexlegends,1706026847.0,t3_19ds5ex
Auto Exiting Death box Page with DS4 Controller every time I clicked X(which is the looting button)?,"I been now experiencing a really annoying bug and it only happens to me when i use roller,Basicly some moment during game, when I want loot a death box, cursor is on the item, clicked X, I didn't click O(exiting button) at all, but the death box page automatically quit. For now the only solution for me is restart the game ,but the bug is coming back at any sec. ",apexlegends,1706026775.0,t3_19ds4bs
C’mon Respawn.,"Just frustrated may delete. This game crashes way to much. Usually I can reconnect which most of the time is just a nuisance. But this last time I was on my last trial (and doing well) when it crashed. 
It couldn’t reconnect and then hit me with an abandon game punishment.",apexlegends,1706025366.0,t3_19drkfq
Sacrificed for the greater good,,apexlegends,1706024621.0,t3_19dra7p
Wattson’s pylon is the worst POI they’ve ever introduced,"Why does everyone insist on hot dropping here? The loot on the perimeter is mid. There are a million angles for you to get sniped from outside forcing everyone inside which can reasonably only fit 3 teams max. There are limited escape routes in tight quarters where someone is probably waiting to one shot you. And if you do make it back outside your teammates are probably deathboxes in the center of the pylon about to watch you get knuckle clustered, vantage ult-ed, or swung on by a lucky pathfinder who didn’t know you were there - he just likes grappling because it’s fun and also has a PK.
I hope we get a new map next season.",apexlegends,1706023977.0,t3_19dr18w
Do you guys think we're getting double Battle Pass stars again at the end of this season?,"They did it in the last two weeks of last season, and that really saved me I & managed to barely complete it then. This season I haven't bothered getting the BP knowing I couldn't have enough time to complete it but I might just get it when the double stars get back on. What do you guys think?",apexlegends,1706022946.0,t3_19dqniz
ALC settings for console,"Does anyone know the ALC settings needed to make 5-4 linear on controller. I want to prepare myself for the AA nerf by removing my AA altogether, but idk what Yaw and pitch correlates to 5-4 linear (my settings rn) I’m hoping there’s a chart out there or something but I was unsuccessful finding it.",apexlegends,1706022204.0,t3_19dqdwb
what is the most iunderrated gun in apex,"2 guns 1 find underrated is havoc and spitfire

havoc: this gun is hard to use i know but if your know how to use this gun you can get some good kills with it havoc without turbocharger would be c tier but a plus tier if turbocharger equipped and its underrated cause you can instantly fry people with it  


spitfire: i wouldnt realy say this gun is underrated cause people are starting to relize this gun buff actually is good and its underrated because theres is basically no recoil and your can fry people easily but its not like it used to be when spitfires was a nightmare in season 8 and 9

but what guns do u think is uderrated ",apexlegends,1706021525.0,t3_19dq4yq
She called it ...,,apexlegends,1706019182.0,t3_19dpbf5
Final Fantasy Heirloom,"Just gonna ask, does the event final fantasy is really possible to get the heirloom for free if we just do the event?",apexlegends,1706018533.0,t3_19dp3e3
Connection issues since update,"Anyone else having issues since the last update? I have been shot through multiple closed doors, rubber banding and i have had the game outright freeze on me multiple times and the app force closing itself. Also noticed some oddities with fuse since the update. Have had multiple times where i have hit someone with a knuckle cluster and the only damage was the initial 10 from the hit.",apexlegends,1706017334.0,t3_19doopp
At least he tried,My pubs lobbies were full of sweats last night… this was one of them lol,apexlegends,1706016618.0,t3_19dog9j
Mediocre shotgun skills finally saved me from a Sword,,apexlegends,1706015950.0,t3_19do8me
"No squad, no ammo, no problem...","Nothing more enjoyable than ratting for your moment to pounce and try stealing a win! Triple take is the best shotgun in the game, change my mind 😎 (yes I know I had energy ammo...)",apexlegends,1706015701.0,t3_19do5ug
How much RAM is enough for Apex?,"So I have a gaming laptop Asus TUF F15 i5 9th gen Nvidia GeForce GTX 1650 4GB Gfx, 8 GB RAM. I was able to play Apex last month or earlier just fine and then it started crashing frequently to the extent that game is not playable anymore. I tried palying valorant and rocket league and they have been crashing too but not as frequently as Apex. I love this game too much and missing out on a lot right now. 


I have been getting this DXGI error when it crashes. Would it help me if I add another 8 GB of RAM? Or is this a different issue all together? Or is it that GTX 1650 is outdated and can't handle Apex anymore?",apexlegends,1706015385.0,t3_19do2df
The game keeps freezing on me.,Like what the title says the game keeps freezing on me on ps5. I haven’t played the game for months I just came back few days ago i just play the mixtape and it’s random sometimes its freeze in the first game sorry in 3rd or 4th game. Idk if it’s a ps5 problem or the game.,apexlegends,1706015122.0,t3_19dnzhs
Nessie plushies 😁❤️,I got my self some of the nessie plushies as i think they are so cute. They got delivered today and ohmygosh they are giving me so much dopamine 🤣❤️,apexlegends,1706012913.0,t3_19dnbkf
cleanest squad wipe,,apexlegends,1706011597.0,t3_19dmyjo
Busting out the Buster,,apexlegends,1706011001.0,t3_19dmsh6
Wierd bug on Kings Canyon PS5,"Spotted wierd bug. My textures flickering in one specific point on the map. Dunno it's my new console or what...

[Bug bug bug wtf](https://youtube.com/shorts/QZE6j5e8ScA?si=da6Ea7icy18FbBO7)",apexlegends,1706009737.0,t3_19dmg3w
