title,selftext,subreddit,created_utc,name
Should Loba be nerfed so she can’t grab heals and maybe shields with her ult?,"I main Wraith and Loba - they’re my 2 most played legends. Recently though with three strikes and because everyone has a lack of heals in that mode, I’ve become kind of frustrated with how scrubby people can be with Loba. Just using ult to steal all the batteries and evo shields in the area…Of course, the Loba is just doing what they’re supposed to be doing and providing loot/support and committing tax fraud. 

I do think it maybe is like genuinely unfair in a way though for the teams that are fighting and stuff like this can encourage ratting in ranked. It’s not like Loba is the sole cause for ratting or anything. Wraith, Horizon, Conduit are all played a lot more than she is, in all game modes. But just throwing Loba ult out, finding a God spot and then yanking evo shields from people fighting is absolutely something people do.

Nerfing her so she can’t grab heals would still give her and her ult a lot of utility. Thoughts?",apexlegends,1705504949.0,t3_198z0i4
People lose their brains when they pick up swords,"I'm loving this event people people lose all tactical skill when they pick up the swords. I havn't played ash in so long, but this even is perfect for her.  You play Ash to feel like a Ronin, I play ash to feel like a Northstar trapping Ronins we are not the same.

https://reddit.com/link/198yvv6/video/09logusdo0dc1/player",apexlegends,1705504622.0,t3_198yvv6
"Best duo in the game, me and myself forever",,apexlegends,1705504128.0,t3_198yoxz
this is what happens when you play with your food,,apexlegends,1705503565.0,t3_198ygzy
Guys I thought of a solution to make the sword less OP,It’s really annoying to put two entire magazines into someone without missing a single shot and they just barely take damage. But what if the sword as a shield had a health meter so it would break or at least not be usable as a shield until your next limit breaker.,apexlegends,1705503086.0,t3_198yal2
"I've the most energy and determination ever in Apex Legends , $150 PC Master player works on 3rd account to Master but does Promos with friends this time!",,apexlegends,1705502650.0,t3_198y4k7
"Actually did my promos on my 3rd alt to Masters with my friends since they wanted to do them with me. We had so much fun playing together 😂 😂 , I got them to stay online longer than normal but I get compliments that I'm fun to play with so that makes my day knowing I can share my love for Apex.",,apexlegends,1705501613.0,t3_198xra4
Benefits of the Buster Sword,"Like most of you, I absolutely hate the sword. Using it / playing against it just feels wrong for Apex imo.

I have realized that over the past week losing all these close quarter and close call fights to the sword has actually been beneficial to my aim and playing. Some of the fights I've lost to the sword required me to play in a cqc better position, utilize cover, move/jump/strafe better and despite all my shots being blocked by the block function on the sword and dying, those fights would 100% be won if it was ""normal"" apex.

Thoughts or anyone else finding that the sword is allowing them to improve their fighting for when its finally removed? 2 more weeks...",apexlegends,1705500861.0,t3_198xhil
[OC] I made a custom Youtube intro in Blender!,,apexlegends,1705499646.0,t3_198x291
Will Rebirth Week 1 Items Return?,"So, I got started a little later for the final fantasy event and didn't have enough gil for every final fantasy item for the first week. I ended up passing on the Nessie holo. Will the Nessie item become available later or maybe the last week of the event? Not sure whether to save some gil for that possibility later or not.",apexlegends,1705499360.0,t3_198wynw
How long do the normal packs take to refresh in the event?,If i buy the 2 normal packs with gil how much do i have to wait for them to be available again?,apexlegends,1705499169.0,t3_198wwad
"ash,revenant or wattson?","I love ash's and revenant's designs and ultimates but wattson looks pretty fun tbh.I can just get one of em,so please,tell me wich one is better

idk if this is important but I main octane (love his movement and design)",apexlegends,1705498118.0,t3_198wjo9
Nessie saved me for the first time,,apexlegends,1705497623.0,t3_198we07
Wingman vs Buster Sword,,apexlegends,1705496762.0,t3_198w479
Just thought this was a good clip considering I never hit my shots🙂,Yeh,apexlegends,1705495663.0,t3_198vrqz
The Kraber is so slay.,,apexlegends,1705495523.0,t3_198vqbj
The sentinel is just better.,,apexlegends,1705495296.0,t3_198vnwf
how can i fix stuttering/lagging in lobby,does anyone has this problem aswell? if so how did you fix it? i cant even go to the firing range because of this. is this a bug or something ?,apexlegends,1705495201.0,t3_198vmxe
"Conduit, Rev, and Stat Boosts","People have been talking about Conduit and her place in the game, and I think the interesting thing about her addition is the fact she came right after Rev Reborn. Both her and this new Rev have something no other Legend in the game has; a direct, uninterative stat boost.

There are plenty of stat boosts in the game, but all of them put emphasis on the action of the user. A speed boost, a handling improvement, a reload speed boost, none of those put up a ""wall"" that the other party hits against because the player with the stat boost pressed a button.

With Rev Reborn, there's a lot more interactivity with hitbox sizes and resets, but the point stands. Losing to Rev Reborn or a Conduit team because they ""just had more stats"" because they pressed a button is incredibly frustrating and uninteractive, in a way no other Legend is. The issue isn't that she heals, Lifeline heals and Wattson heals, the issue is that she offers a direct stat improvement that the opposing team can't do anything about.

I think this is worrying for the direction of abilities. Straight stat upgrades on a button press that the opponent is forced to break against is not healthy for any competitive game, it's too direct an advantage.",apexlegends,1705494588.0,t3_198vgl1
Can we abolish Octane,Why do all octane mains (or the ones I always seem to team up with)  just do their own thing!!??,apexlegends,1705493241.0,t3_198v2i3
Kill cam,With the kill cam now i can see how much i am off from the real time in game. Its like i am jumping and sliding but the kill cam show me i am still just standing and starting only to move. Its the game tick rate(i think its called like that) fault or i just should play on monitor and not tv?,apexlegends,1705493033.0,t3_198v0ff
Apex's Most Hated Player,,apexlegends,1705492614.0,t3_198uw20
Random vantage teammates are the worst,"Without exception the worst teammate you can have in solo ranked.  Playing clicking simulator alone on a high building. 

/EndRant",apexlegends,1705492129.0,t3_198urea
Why are some servers just lower ping than others ( i live in south east asia),"Other games i play in singapore servers i get 12ms ping, so it isnt my internet.

https://preview.redd.it/eyf1jve5hzcc1.png?width=327&format=png&auto=webp&s=4a0365470a7006dbf4566a69434533819ed181d7

https://preview.redd.it/x0qij338hzcc1.png?width=449&format=png&auto=webp&s=3f77d179c69d8d7d2696c46934f5b5870faac6f9

&#x200B;",apexlegends,1705490087.0,t3_198u84e
Nice Lil toss,,apexlegends,1705489502.0,t3_198u2q9
Buster sword,"Will we ever see the buster sword or will be gone forever ? It gives the game the game such a good refreshment from the old br style , might be even needed as apex player count is verry low and gets lower with every season",apexlegends,1705488392.0,t3_198ts8q
Looking for advice on improving my gameplay,"I know how close to getting knocked I was the entire time, hp steal really clutched it. This was pubs and both my team and enemy team were not the greatest. I certainly made my mistakes and thats where I want to learn.",apexlegends,1705487629.0,t3_198tldm
Which is better an r-99 or a havoc with turbo charger?,Personaly i like the havoc I think its better because of all the nerfs the r-99 got,apexlegends,1705485329.0,t3_198t1gd
It'd be cool is bp stars transferred over,"I'm already max, but keep getting all the useless stars for the bp I already have done. Would be a cool idea if the game somehow kepts track of them and applied them to the next bp. To make it fair, it would only apply to the next season. That way it makes the grind easier for the next season and you get to continue to play and ""earn"" items, even if you can't get those items immediately.",apexlegends,1705484989.0,t3_198sylz
Gifting Problem,I’ve been having this gifting problem does anyone know when it will be pateched or fixed ?,apexlegends,1705482315.0,t3_198scgu
"Mid air sword fight with gravity lift, I wish I can see it from the 3rd person",,apexlegends,1705479870.0,t3_198rs8h
"To be honest, I was thinking about aim assist."," This is one idea, but wouldn't hip-fire aim assist be necessary? I think hip-fire aiming is difficult until you get used to it, whether it's keyboard mouse play or controller play. Also, if you play CS, you've probably experienced this at least once, but sometimes you get sucked in by an enemy you've knocked down, and your bullets don't hit the enemy the way you want. The aim is stuck to an enemy that is not the one you were aiming for. When performing flick operations, the hip-fired aim assist slows down the operation and causes the aim to point closer to you than you intended.  Aim assist is enabled only when aiming. How about introducing a system that allows you to switch, such as disabling aim assist only when shooting from the hip? ",apexlegends,1705479711.0,t3_198rqxl
When you got no where to go but up from top 10,It was funny hearing my teammates being surprised at my push up with 2 squads up there but with no negative penalty being in top 10 I YOLO’d the climb 😂,apexlegends,1705478722.0,t3_198ripq
"Weapon Wednesday: Mastiff | January 17th, 2024","Welcome to **Weapon Wednesday!** This discussion thread focuses specifically on a randomly chosen weapon.

Today's Weapon discussion is focused around: **Mastiff**!

Discuss what you like or dislike about this weapon; how it compares to other weapons; your favorite skins; changes that you think would be beneficial; or anything else that you think would be of value to discuss regarding the **Mastiff**.

Moderation in daily threads is more relaxed, but please stay on topic, be respectful of others and remember our [rules](https://www.reddit.com/r/apexlegends/wiki/rules)


---
Suggestions or feedback for these daily posts? Message [Modmail](https://www.reddit.com/message/compose?to=%2Fr%2Fapexlegends)!",apexlegends,1705478401.0,t3_198rfv4
My Patch Notes,"Before we start I want to mention I am trying to take in the fact of many factors like Competitive, casual and how to code/implement it.I am trying to buff weaker characters and overall trying to level the field.

Fuze:50% gernade resistance(no ultimates or abilities) 
Gives him more synergy and helps survivability

Ash:Ability to snare up to 2 people in one snare.Ult -30 sec and travel faster in phase.
The ability to snare 2 people would be a nice cc and making the ult up to par with wraith.

Ballistic:Passive swap time like if it had a blue stock, Weapon strafe speed in ult are reduce to a min of an AR,ex:LMG and snipers will have the same strafe speed as an AR and pistols and smg strafe speed will be inchaged.
It can give more variety to the ballistic and improve the feeling of using the ult.
 
Path:Passive to heal on zip, come on its a little obvious

Octane:If using tactical while reviving, 15% faster 
This may be big change but it will give Octane more of a team feel and playmaking ability.

Valk:Ult -30 sec  nothing big 

Crypto:Can ""Hack"" empty containers for extra mats +10 per. 
Crypto is a characters that preps so giving him this ability is not far off.

Seer:NO

Vantage:Tactical-echo will make a sound q signifying people near by. When person is hit with ult they do a sonar pulse every 2 second in a 8 meter radius,the scan works like old bloodhound scan.
These changes will make Vantage feel more rewarding and fit in her class.

Lifeline:tactical works like Newcastle tactical but slower,Ult only drop purple armor(no more blue armor)
Simple but effective changes to her kit.

Mirage:when bamboozled, .5 sec light arcstar stun(resets every second) and 5% damage intake for bamboozled effective duration.
Mirage's bamboozles never felt rewarding or punishing, I went with 5% damage intake over flat damage bc it would be annoying and not rewarding in higher level play.

Conduit:Tactical-space out the regeneration by 2 second
It's both a buff and nerf, you have it longer but less potent.

Loba:Passive-pinging shows items location ex:teammate pings ""I need sheilds"" it shows the shields with her passive. 1 pingable per person 
It could be hard to code in but This could be the push loba needs.

Caustic:tactical-deploy has 50 hp instead of 1 hp
Small buff to help him compete with the other controllers

Rampart: Tactical be able to through walls like caustic trap (can toggle off and on),Ult works like Vantage in 4 waves 
Rampart can be more active with these changes and be a aggressive as well.

Catalysts:Barricades without doors can be destroyed, have 200 hp 
This will tone back how annoying it is to fight against a catalysts.

If there anything you think should be changed Or can be added on, please let me know.",apexlegends,1705478079.0,t3_198rd6r
Reminds me of the time Sephiroth swooped down and stabbed Aerith,,apexlegends,1705475889.0,t3_198qt6n
Whats this weird badge name and desc,"&#x200B;

[Theres the screenshot, I kinda think its rare and I really like it but I realize i wanted to share this with others](https://preview.redd.it/qng9lr3bbycc1.png?width=990&format=png&auto=webp&s=c08e8a30a96a3d30e6af9b7ce0b227300050c319)",apexlegends,1705475895.0,t3_198qt8t
Double Cactus Apex tick,"Double cactus tick, thought it was cool. 😎 ",apexlegends,1705475040.0,t3_198ql60
There needs to be a major rework for the control legends on Mixtape.,"Why is is it that these traps can stay up for the full length duration of a match where half of a team can easliy camp and be annoying. I don't have any legends that can counter them, it makes no sense. Make it so that their tacticals do not replinish on respawn, and have the traps sit on a timer. Its not tactical or strategic gameplay, its easy bs. Has anyone else seen how bad this is.

Maybe a few maps should be redesigned too IDK. Possibly limit how much a team can have (might not make sense) or add an ordinance to the game like a arc grenade from tf2 that disables them or can actually stun enemies.


Edit: All i wanted was to see if other people have had this problem before, or if anyone had any ideas or ways they may have fixed it for themselves. While I appreciate the feedback, I'm just going to take this to another forum you guys. I didnt know that this gets people riled up here.",apexlegends,1705474649.0,t3_198qh9m
Pretty much how my push for Masters has been going,,apexlegends,1705474202.0,t3_198qd3s
So how the fuck am I supposed to counter this Bull shit sword,I hate this thing when someone uses it I can’t do shit and get obliterated but when I use it I’m hitting people with pillow wrapped in fucking marshmallow,apexlegends,1705472794.0,t3_198pzqj
FF14 Event Shop Pack Question,"if you have all the packs already (I don't just curious), what happens to the shop pack? can you not buy it or does it give u some coins back?",apexlegends,1705471072.0,t3_198phr4
Post Malone’s Rockstar and You are the Jumpmaster remix,"there used to be this really cool remix of Rockstar and You are the Jumpmaster, i can’t find it on youtube because it’s most likely been removed, but if anyone knows what i’m talking about please point me in the right direction, it’s my favorite remix. Thanks!!",apexlegends,1705470743.0,t3_198peec
No more of those fun late game situations because of… evac towers?,"I played about 5 games of ranked tonight, and maybe 5-10 the previous few days as a Diamond II. Probably 80% of the games had 15+ squads alive by the start of ring 3. 


Inevitably, this means that by the next ring I’m stuck with my solo q team hiding behind poor cover until another team can 30-30 us down. Sometimes we’re the team doing it, but regardless that’s not as fun. 


The fun part is beating a team 1 on 1, and that rarely seems to happen anymore. Either we swoop up an easy sweep or right when we’re winning another team starts taking pot shots. 


I wonder if the cause is because of evac towers. There’s no doubt it’s the most common survival item on the floor for some reason. Without evac towers, teams were forced to hold their ground in early ring 1 or 2 and rotators like path or valk or wraith were valuable for escaping. But now with evac towers everyone escapes every engagement, so then by ring 3 there’s 45 people alive. And now the support class is the most valuable class because if you don’t have an evac tower then you can craft",apexlegends,1705470324.0,t3_198pa0j
"Nothing can stop me, not even Wattson fences xD","I was laughing so hard xD Buster sword is... busted I guess xD

https://reddit.com/link/198otrr/video/g57ghhg7qxcc1/player",apexlegends,1705468798.0,t3_198otrr
This happen to anyone else?,,apexlegends,1705466840.0,t3_198o8ig
R99 challenges,"Am I the only one who thinks the r99 challenges don't track coz I've played many mixtape matches and the level 40 and 100 challenges don't track no matter how many times I do them. Before y'all say it doesn't work in mixtape it's worked for a few times and stopped. For the level 40 challenge some of y'all keep saying""u have to one clip them at full health, have more than one bullet left in the mag and don't release the trigger during hipfire"" I've done it more than 20 times and it's stopped tracking at 12. I've even gone as far as queuing up with someone on opposite teams to keep trying and it doesn't work. Same as the level 100 challenge, I've hit all my shots on a stationary target multiple times and it hasn't worked even once.

To those of y'all who completed the challenges how did you do them?",apexlegends,1705465269.0,t3_198nqxx
Yall remember WaterGotHim?,[https://www.youtube.com/@WaterOW2](https://www.youtube.com/@WaterOW2) he's trying to get back on the saddle.  ,apexlegends,1705465231.0,t3_198nqi3
Bind us standards,script command 3 is change firing mode / command 4 is take current selected heal item / command 2 held is heal wheel / weaponselectordnance is grenade / command 5 is character utility action for example ballistic taking out and holstering his swing weapon / mouse 3 is your mousewheel click / offhand 4 is ulti / say team is writing in chat / toggle zoom is aim / mouse 4 is your rear thumb button and mouse 5 is your front thumb button / offhand 1 is tactical / command 6 is survival item (heatshield),apexlegends,1705464173.0,t3_198neco
Help with admin cheat issue: can't find any solutions,"I've tried making anticheat run as admin, apex run as admin, going through my settings and repairing it. This happens with fortnite too. It was fine a few months ago

https://preview.redd.it/wcuv9fusaxcc1.png?width=1920&format=png&auto=webp&s=c4899042530cf93cab72ed0a36c4e3988b708bfc",apexlegends,1705463611.0,t3_198n7ki
Nessie is the best thing in this event,I was laughing with my friend for a good min when the nessie secured the wipe ,apexlegends,1705463127.0,t3_198n20i
You can’t make this shit up,,apexlegends,1705463034.0,t3_198n0wt
Can't gift,"I enabled everything I needed to for gifting, have been friends with this person for a very long time on EA, everything lines up... UNTIL I try to gift. Then I sit in an eternal loading hell and never get to send the gift. Help?",apexlegends,1705462890.0,t3_198mz99
So mad not even a single kill,,apexlegends,1705462150.0,t3_198mqd6
Did AA get nerfed?,"My tracking has not the same since the new update dropped, is anyone else running into this?",apexlegends,1705460530.0,t3_198m6if
"Small compilation of great sentinel shots, enjoy!",,apexlegends,1705460070.0,t3_198m0my
Bug on console,"There is a bug in which when I choose and confirm the legend very quickly on the legend selection screen,after entering the match, I am unable to loot deathboxes, use the Loba Black market,And also the game settings this bug is only resolved when I close and open the game, I wanted to ask if I'm the only one facing this bug",apexlegends,1705459326.0,t3_198lr7t
"Lorehounds, what's this about?",,apexlegends,1705458799.0,t3_198lkap
Some little suggestions..,"I know the game is rife with cheating and there’s probably much bigger problems, but I reckon there’s a few small things which would make the experience a lot better 

First one, reverse the order of the seasons, its so frustrating having to scroll all the way down to see ranked season 19 stats

Second, let us drop an entire stack of syringes/shield cells at a time, you let us do it with Ammo, why do we have to do health or shields one at a time!? 

Third, keep voice while the game loads or going back to the lobby (specifically when cross playing) - I know you can get discord, we tried it, there’s a delay because PS5 discord integration is garbage 

And this is one for all you Fuse mains out there, let us open the damn explosive holds with our ults! 

Anything that’s small(ish) that frustrates you?",apexlegends,1705458463.0,t3_198lfu9
I speak for everyone when I say Respawn should recycle battlepasses for noobs,"I started playing in season 12, a full 2 years after season 4. I’ve always loved cyborg/robotic skins especially in games like Apex and Overwatch. For Revenant’s heirloom recolor and prestige skin they did a lot of cyborg/Revenantized skins and it made me think about how cool the S4 skins are and I’m so sad I can’t ever get them :(

I have Wraith’s recolor from Revenant’s recolor (lol) event but it just doesn’t compare to the original.",apexlegends,1705458081.0,t3_198laxx
FPS Drops/Stuttering - S19 Ignite,"I have posted here a few times about this and have gotten really no help. This time I am going to attach clips of my settings and examples of the stutter/fps drops. Hopefully this will get more people to help me out here. My computer specs are below. Yes my gpu is up to date, Yes there is plenty of storage on the ssd I play the game on, yes I have optimized my nvidia control pannel settings for best fps performance possible, my internet speeds are about 600 gbps download. Any help I WOULD LOVE! PLEASE HELP ME. My game does these stutters about every 3 minutes. Also, I have tried dx12... yes the lag goes away but my fps is super low like 70-90 which feels super awful when playing. Also I have two monitors so in dx12 I click off my screen because dx12 doesn't lock your screen in even when your settings are on fullscreen.

 

CPU: Ryzen Threadripper 1900x 8 core 16 logical

GPU: RTX 2060 Super 8GB

Ram: 32 GB ddr4

MOBO: X399 Phantom Gaming Pro AS Rock

https://reddit.com/link/198l93g/video/6mdigykbtwcc1/player

https://reddit.com/link/198l93g/video/ad7hjikbtwcc1/player

https://reddit.com/link/198l93g/video/k8eoflkbtwcc1/player",apexlegends,1705457943.0,t3_198l93g
Different monitors for apex,"I play ps5, I usually play on a 75 in tv and the picture is amazing but I switched to my hotel tv and everything seems super zoomed out. On my tv at home a x1 scope has as much distance and clarity as a X3 scope which obviously effects game play. Both tvs are on default settings. What makes that difference, wanting to know cuz I’m about to go buy a tv or monitor and love the zoomed in visual my main tv has",apexlegends,1705457228.0,t3_198kzw4
Why apex always crashes,Why does apex crash every 30 minutes? It costs me games and rank points. Im to nervous to even play ranked anymore because it crashes at the worst time possible.,apexlegends,1705456897.0,t3_198kvj5
Ltm idea,"Ok hear me out! An LTM called op day (obviously something more flashy) but whatever! Everything reverts back or goes to the time when it was the most op! Seems simple but i think it could be fun!
I’m talking launch day Seer and Horizon,
Revtane revitalized, Lifeline shield drone res,8 shots in the hit scan charge riffle! 
3x on r99 (remember that?!?) fast heals on gold shield, bring back the Gold revive shield
 karber being one shot kill. And for the newer characters just buff them up a lil to keep up or for some test out reworks!",apexlegends,1705456078.0,t3_198kkwg
Clarity on FF7 event loot boxes,"I'm seeing some lootboxes you can buy with the gil you earned and those are just regular loot boxes and not the event ones that include the FF7 items (the sword)?

The only way to get the sword for free is either getting hyper lucky or having enough shards, correct?",apexlegends,1705455944.0,t3_198kj5j
apex on last gen,"having a lot of stutter, frame and packet loss issues with apex whereas other games all seem fine. is there anyway to somewhat mitigate these issues or do I just uninstall till the day I go next Gen?",apexlegends,1705454745.0,t3_198k3lq
Can’t sprint,I just redownloaded the game and when I loaded in I can’t sprint. I have auto sprint enabled and I can only sprint with double tap. I use the game sir g7 on Xbox series s. I tried using my other controller and I could sprint normally but it has stick drift. Does anyone know a fix?,apexlegends,1705454313.0,t3_198jxwz
